[
  {
    "id": "dynasty_legendary",
    "name": "传说时代",
    "startYear": -2500,
    "endYear": -2070,
    "color": "#A8A29C",
    "colorDark": "#7A6A6A",
    "yearUncertainty": "era",
    "_yearAuthority": "传说,无定论",
    "historicity": "legendary",
    "_schemaVersion": "v0.6",
    "source": "wxh06+manual"
  },
  {
    "id": "dynasty_xia",
    "name": "夏",
    "startYear": -2070,
    "endYear": -1600,
    "color": "#B97A56",
    "colorDark": "#D49678",
    "yearUncertainty": "century",
    "_yearAuthority": "夏商周断代工程",
    "historicity": "semi-historical",
    "_schemaVersion": "v0.6",
    "source": "wxh06+manual"
  },
  {
    "id": "dynasty_shang",
    "name": "商",
    "startYear": -1600,
    "endYear": -1046,
    "color": "#8B6F47",
    "colorDark": "#A88B5F",
    "yearUncertainty": "century",
    "_yearAuthority": "夏商周断代工程",
    "historicity": "semi-historical",
    "_schemaVersion": "v0.6",
    "source": "wxh06+manual"
  },
  {
    "id": "dynasty_western_zhou",
    "name": "西周",
    "startYear": -1046,
    "endYear": -771,
    "color": "#C04848",
    "colorDark": "#D86060",
    "yearUncertainty": "year",
    "_yearAuthority": "夏商周断代工程",
    "historicity": "historical",
    "_schemaVersion": "v0.6",
    "source": "wxh06+manual"
  },
  {
    "id": "dynasty_eastern_zhou",
    "name": "东周",
    "startYear": -770,
    "endYear": -221,
    "color": "#A89858",
    "colorDark": "#C2B070",
    "yearUncertainty": "year",
    "_yearAuthority": "夏商周断代工程",
    "historicity": "historical",
    "_schemaVersion": "v0.6",
    "source": "wxh06+manual",
    "summary": "春秋(前770-前476)+ 战国(前475-前221)合并为东周。",
    "regimeIds": [
      "regime_chu",
      "regime_chu_state_sa",
      "regime_han_state",
      "regime_jin_state_sa",
      "regime_lu",
      "regime_qi",
      "regime_qi_state_sa",
      "regime_qin_state",
      "regime_qin_state_sa",
      "regime_song_state",
      "regime_wei_state",
      "regime_wu_state",
      "regime_yan",
      "regime_zhao"
    ]
  },
  {
    "id": "dynasty_qin",
    "name": "秦",
    "startYear": -221,
    "endYear": -207,
    "color": "#2D2A26",
    "colorDark": "#4A4540",
    "yearUncertainty": "year",
    "_yearAuthority": "夏商周断代工程",
    "historicity": "historical",
    "_schemaVersion": "v0.6",
    "source": "wxh06+manual"
  },
  {
    "id": "dynasty_western_han",
    "name": "西汉",
    "startYear": 24,
    "endYear": 9,
    "color": "#B8473C",
    "colorDark": "#D45C50",
    "yearUncertainty": "year",
    "_yearAuthority": "夏商周断代工程",
    "historicity": "historical",
    "_schemaVersion": "v0.6",
    "source": "wxh06+manual"
  },
  {
    "id": "dynasty_xin",
    "name": "新莽",
    "startYear": 9,
    "endYear": 23,
    "color": "#997A5C",
    "colorDark": "#B59070",
    "yearUncertainty": "year",
    "_yearAuthority": "夏商周断代工程",
    "historicity": "historical",
    "_schemaVersion": "v0.6",
    "source": "wxh06+manual"
  },
  {
    "id": "dynasty_eastern_han",
    "name": "东汉",
    "startYear": 25,
    "endYear": 220,
    "color": "#A04E45",
    "colorDark": "#BC665D",
    "yearUncertainty": "year",
    "_yearAuthority": "夏商周断代工程",
    "historicity": "historical",
    "_schemaVersion": "v0.6",
    "source": "wxh06+manual"
  },
  {
    "id": "dynasty_three_kingdoms",
    "name": "三国",
    "startYear": 220,
    "endYear": 280,
    "color": "#5C6F94",
    "colorDark": "#7589AB",
    "yearUncertainty": "year",
    "_yearAuthority": "夏商周断代工程",
    "historicity": "historical",
    "_schemaVersion": "v0.6",
    "source": "wxh06+manual",
    "summary": "魏/蜀/吴并立,详见 regimes。",
    "regimeIds": [
      "regime_shu",
      "regime_wei",
      "regime_wu"
    ]
  },
  {
    "id": "dynasty_western_jin",
    "name": "西晋",
    "startYear": 266,
    "endYear": 316,
    "color": "#6B4F75",
    "colorDark": "#85688E",
    "yearUncertainty": "year",
    "_yearAuthority": "夏商周断代工程",
    "historicity": "historical",
    "_schemaVersion": "v0.6",
    "source": "wxh06+manual"
  },
  {
    "id": "dynasty_eastern_jin",
    "name": "东晋",
    "startYear": 317,
    "endYear": 420,
    "color": "#806F94",
    "colorDark": "#9888AC",
    "yearUncertainty": "year",
    "_yearAuthority": "夏商周断代工程",
    "historicity": "historical",
    "_schemaVersion": "v0.6",
    "source": "wxh06+manual"
  },
  {
    "id": "dynasty_sixteen_kingdoms",
    "name": "十六国",
    "startYear": 304,
    "endYear": 439,
    "color": "#8C6B4B",
    "colorDark": "#A8856A",
    "yearUncertainty": "year",
    "_yearAuthority": "夏商周断代工程",
    "historicity": "historical",
    "_schemaVersion": "v0.6",
    "source": "wxh06+manual",
    "summary": "北方 16 国并立,详见 regimes。",
    "regimeIds": [
      "regime_cheng_han",
      "regime_former_liang",
      "regime_former_qin",
      "regime_former_yan",
      "regime_han_zhao",
      "regime_hu_xia",
      "regime_later_liang_16",
      "regime_later_qin",
      "regime_later_yan",
      "regime_later_zhao",
      "regime_northern_liang",
      "regime_northern_yan",
      "regime_southern_liang",
      "regime_southern_yan",
      "regime_western_liang",
      "regime_western_qin"
    ]
  },
  {
    "id": "dynasty_southern_northern",
    "name": "南北朝",
    "startYear": 420,
    "endYear": 589,
    "color": "#A89858",
    "colorDark": "#C2B070",
    "yearUncertainty": "year",
    "_yearAuthority": "夏商周断代工程",
    "historicity": "historical",
    "_schemaVersion": "v0.6",
    "source": "wxh06+manual",
    "summary": "南朝(宋齐梁陈)+ 北朝(北魏分裂为东西魏 → 北齐北周),详见 regimes。",
    "regimeIds": [
      "regime_chen",
      "regime_eastern_wei",
      "regime_liang_southern",
      "regime_northern_qi",
      "regime_northern_wei",
      "regime_northern_zhou",
      "regime_qi_southern",
      "regime_song_liu",
      "regime_western_wei"
    ]
  },
  {
    "id": "dynasty_sui",
    "name": "隋",
    "startYear": 581,
    "endYear": 618,
    "color": "#3F5B7C",
    "colorDark": "#5C7898",
    "yearUncertainty": "year",
    "_yearAuthority": "夏商周断代工程",
    "historicity": "historical",
    "_schemaVersion": "v0.6",
    "source": "wxh06+manual"
  },
  {
    "id": "dynasty_tang",
    "name": "唐",
    "startYear": 618,
    "endYear": 907,
    "color": "#C84E4E",
    "colorDark": "#E07070",
    "yearUncertainty": "year",
    "_yearAuthority": "夏商周断代工程",
    "historicity": "historical",
    "_schemaVersion": "v0.6",
    "source": "wxh06+manual"
  },
  {
    "id": "dynasty_five_dynasties_ten_kingdoms",
    "name": "五代十国",
    "startYear": 907,
    "endYear": 979,
    "color": "#806147",
    "colorDark": "#997D62",
    "yearUncertainty": "year",
    "_yearAuthority": "夏商周断代工程",
    "historicity": "historical",
    "_schemaVersion": "v0.6",
    "source": "wxh06+manual",
    "summary": "北方五代相继 + 南方十国并立,详见 regimes。",
    "regimeIds": [
      "regime_later_han",
      "regime_later_jin",
      "regime_later_liang",
      "regime_later_tang",
      "regime_later_zhou"
    ]
  },
  {
    "id": "dynasty_song",
    "name": "宋",
    "startYear": 960,
    "endYear": 1279,
    "color": "#5E8970",
    "colorDark": "#7AA38B",
    "yearUncertainty": "year",
    "_yearAuthority": "夏商周断代工程",
    "historicity": "historical",
    "_schemaVersion": "v0.6",
    "source": "wxh06+manual",
    "summary": "北宋(960-1127)+ 南宋(1127-1279)合并显示,与辽/西夏/金并立。"
  },
  {
    "id": "dynasty_yuan",
    "name": "元",
    "startYear": 1206,
    "endYear": 1388,
    "color": "#3F4F7C",
    "colorDark": "#5C6E98",
    "yearUncertainty": "year",
    "_yearAuthority": "夏商周断代工程",
    "historicity": "historical",
    "_schemaVersion": "v0.6",
    "source": "wxh06+manual",
    "summary": "蒙古(1206-1271)→ 元(1271-1368)→ 北元(1368-1388)。"
  },
  {
    "id": "dynasty_ming",
    "name": "明",
    "startYear": 1368,
    "endYear": 1662,
    "color": "#B85D6E",
    "colorDark": "#D27689",
    "yearUncertainty": "year",
    "_yearAuthority": "夏商周断代工程",
    "historicity": "historical",
    "_schemaVersion": "v0.6",
    "source": "wxh06+manual"
  },
  {
    "id": "dynasty_qing",
    "name": "清",
    "startYear": 1616,
    "endYear": 1912,
    "color": "#4A6E8C",
    "colorDark": "#688AAB",
    "yearUncertainty": "year",
    "_yearAuthority": "夏商周断代工程",
    "historicity": "historical",
    "_schemaVersion": "v0.6",
    "source": "wxh06+manual"
  },
  {
    "id": "dynasty_republic",
    "name": "中华民国",
    "startYear": 1912,
    "endYear": 1949,
    "color": "#6E7B82",
    "colorDark": "#8A969D",
    "yearUncertainty": "exact",
    "_yearAuthority": "夏商周断代工程",
    "historicity": "historical",
    "_schemaVersion": "v0.6",
    "source": "wxh06+manual"
  },
  {
    "id": "dynasty_prc_pre_reform",
    "name": "新中国(1949-1978)",
    "startYear": 1949,
    "endYear": 1978,
    "color": "#4A4A4A",
    "colorDark": "#6A6A6A",
    "yearUncertainty": "exact",
    "_yearAuthority": "夏商周断代工程",
    "historicity": "historical",
    "_schemaVersion": "v0.6",
    "source": "wxh06+manual"
  }
]